Sheet: 属性换算
A1: #%
B2: 生命 | C2: 攻击 | D2: 护甲
A3: 基础属性 | B3: 1 | C3: 0.5 | D3: 0.25
A4: 成长属性 | B4: 1 | C4: 0.25 | D4: 0.125
A6: CNMAA 我是高手阿

Sheet: 地图
A1: #map
A2: $Map | B2: name
A3: test | B3: 测试地图
A4: #xml:sectionArr
A5: $Section | B5: type | C5: chance | D5: waveNumArrData | E5: waveMonsterNumArrData | F5: waveMonsterCardArrData
A6: s1 | B6: 1 | C6: 1 | D6: 3,4,5 | E6: 1,2,3 | F6: 小战士:1,小法师:1,小猎人:1
A7: s2 | B7: 1 | C7: 1 | D7: 3,4,5 | E7: 1,2,3 | F7: 宝箱:1,牧师:5,山洞蝙蝠:5,洋娃娃:5
A8: #endxml

Sheet: 怪物
A1: #battler
A2: $Battler | B2: name | C2: skin | D2: level | E2: lifeBase | F2: attackBase | G2: armorBase | H2: lifeGrow | I2: attackGrow | J2: armorGrow | K2: %生命 | L2: %攻击 | M2: %护甲 | N2: %生命成长 | O2: %攻击成长 | P2: %护甲成长 | Q2: %生命修正 | R2: %攻击修正 | S2: %护甲修正
A3: 小战士 | B3: 小战士 | C3: Fighter01 | D3: 1 | E3: =RC[12]+100*RC[9] -> 50 | F3: =RC[12]+100*RC[9]*0.5 -> 25 | G3: =RC[12]+100*0.25*RC[9] -> 0 | H3: =RC[6]*20 -> 10 | I3: =RC[6]*0.25*20 -> 2.5 | J3: =RC[6]*0.125*20 -> 0 | K3: =RC[-6]+RC[-7]*RC[-3] -> 60 | L3: =RC[-6]+RC[-8]*RC[-3] -> 27.5 | M3: =RC[-6]+RC[-9]*RC[-3] -> 0 | N3: 0.5 | O3: 0.5 | P3: 0 | Q3: 0 | R3: 0 | S3: 0
A4: 小法师 | B4: 小法师 | C4: Mage06 | D4: 1 | E4: =RC[12]+100*RC[9] -> 25 | F4: =RC[12]+100*RC[9]*0.5 -> 12.5 | G4: =RC[12]+100*0.25*RC[9] -> 12.5 | H4: =RC[6]*20 -> 5 | I4: =RC[6]*0.25*20 -> 1.25 | J4: =RC[6]*0.125*20 -> 1.25 | K4: =RC[-6]+RC[-7]*RC[-3] -> 30 | L4: =RC[-6]+RC[-8]*RC[-3] -> 13.75 | M4: =RC[-6]+RC[-9]*RC[-3] -> 13.75 | N4: 0.25 | O4: 0.25 | P4: 0.5 | Q4: 0 | R4: 0 | S4: 0
A5: 小牧师 | B5: 小牧师 | C5: Cleric01 | D5: 1 | E5: =RC[12]+100*RC[9] -> 40 | F5: =RC[12]+100*RC[9]*0.5 -> 10 | G5: =RC[12]+100*0.25*RC[9] -> 10 | H5: =RC[6]*20 -> 8 | I5: =RC[6]*0.25*20 -> 1 | J5: =RC[6]*0.125*20 -> 1 | K5: =RC[-6]+RC[-7]*RC[-3] -> 48 | L5: =RC[-6]+RC[-8]*RC[-3] -> 11 | M5: =RC[-6]+RC[-9]*RC[-3] -> 11 | N5: 0.4 | O5: 0.2 | P5: 0.4 | Q5: 0 | R5: 0 | S5: 0
A6: 小猎人 | B6: 小猎人 | C6: Hunter03 | D6: 1 | E6: =RC[12]+100*RC[9] -> 30 | F6: =RC[12]+100*RC[9]*0.5 -> 35 | G6: =RC[12]+100*0.25*RC[9] -> 0 | H6: =RC[6]*20 -> 6 | I6: =RC[6]*0.25*20 -> 3.5 | J6: =RC[6]*0.125*20 -> 0 | K6: =RC[-6]+RC[-7]*RC[-3] -> 36 | L6: =RC[-6]+RC[-8]*RC[-3] -> 38.5 | M6: =RC[-6]+RC[-9]*RC[-3] -> 0 | N6: 0.3 | O6: 0.7 | P6: 0 | Q6: 0 | R6: 0 | S6: 0
A7: 大黄蜂 | B7: 大黄蜂 | C7: Monster01 | D7: 1 | E7: =RC[12]+100*RC[9] -> 50 | F7: =RC[12]+100*RC[9]*0.5 -> 25 | G7: =RC[12]+100*0.25*RC[9] -> 0 | H7: =RC[6]*20 -> 10 | I7: =RC[6]*0.25*20 -> 2.5 | J7: =RC[6]*0.125*20 -> 0 | K7: =RC[-6]+RC[-7]*RC[-3] -> 60 | L7: =RC[-6]+RC[-8]*RC[-3] -> 27.5 | M7: =RC[-6]+RC[-9]*RC[-3] -> 0 | N7: 0.5 | O7: 0.5 | P7: 0 | Q7: 0 | R7: 0 | S7: 0
A8: 山洞蝙蝠 | B8: 山洞蝙蝠 | C8: Monster02 | D8: 2 | E8: =RC[12]+100*RC[9] -> 20 | F8: =RC[12]+100*RC[9]*0.5 -> 40 | G8: =RC[12]+100*0.25*RC[9] -> 0 | H8: =RC[6]*20 -> 4 | I8: =RC[6]*0.25*20 -> 4 | J8: =RC[6]*0.125*20 -> 0 | K8: =RC[-6]+RC[-7]*RC[-3] -> 28 | L8: =RC[-6]+RC[-8]*RC[-3] -> 48 | M8: =RC[-6]+RC[-9]*RC[-3] -> 0 | N8: 0.2 | O8: 0.8 | P8: 0 | Q8: 0 | R8: 0 | S8: 0
A9: 洋娃娃 | B9: 洋娃娃 | C9: Monster03 | D9: 3 | E9: =RC[12]+100*RC[9] -> 60 | F9: =RC[12]+100*RC[9]*0.5 -> 20 | G9: =RC[12]+100*0.25*RC[9] -> 0 | H9: =RC[6]*20 -> 12 | I9: =RC[6]*0.25*20 -> 2 | J9: =RC[6]*0.125*20 -> 0 | K9: =RC[-6]+RC[-7]*RC[-3] -> 96 | L9: =RC[-6]+RC[-8]*RC[-3] -> 26 | M9: =RC[-6]+RC[-9]*RC[-3] -> 0 | N9: 0.6 | O9: 0.4 | P9: 0 | Q9: 0 | R9: 0 | S9: 0
A10: 毒蘑菇 | B10: 毒蘑菇 | C10: Monster04 | D10: 6 | E10: =RC[12]+100*RC[9] -> 90 | F10: =RC[12]+100*RC[9]*0.5 -> 5 | G10: =RC[12]+100*0.25*RC[9] -> 0 | H10: =RC[6]*20 -> 18 | I10: =RC[6]*0.25*20 -> 0.5 | J10: =RC[6]*0.125*20 -> 0 | K10: =RC[-6]+RC[-7]*RC[-3] -> 198 | L10: =RC[-6]+RC[-8]*RC[-3] -> 8 | M10: =RC[-6]+RC[-9]*RC[-3] -> 0 | N10: 0.9 | O10: 0.1 | P10: 0 | Q10: 0 | R10: 0 | S10: 0
A11: 蝎子 | B11: 蝎子 | C11: Monster05 | D11: 10 | E11: =RC[12]+100*RC[9] -> 50 | F11: =RC[12]+100*RC[9]*0.5 -> 25 | G11: =RC[12]+100*0.25*RC[9] -> 0 | H11: =RC[6]*20 -> 10 | I11: =RC[6]*0.25*20 -> 2.5 | J11: =RC[6]*0.125*20 -> 0 | K11: =RC[-6]+RC[-7]*RC[-3] -> 150 | L11: =RC[-6]+RC[-8]*RC[-3] -> 50 | M11: =RC[-6]+RC[-9]*RC[-3] -> 0 | N11: 0.5 | O11: 0.5 | P11: 0 | Q11: 0 | R11: 0 | S11: 0
A12: 软泥怪 | B12: 软泥怪 | C12: Monster06 | D12: 12 | E12: =RC[12]+100*RC[9] -> 40 | F12: =RC[12]+100*RC[9]*0.5 -> 30 | G12: =RC[12]+100*0.25*RC[9] -> 0 | H12: =RC[6]*20 -> 8 | I12: =RC[6]*0.25*20 -> 3 | J12: =RC[6]*0.125*20 -> 0 | K12: =RC[-6]+RC[-7]*RC[-3] -> 136 | L12: =RC[-6]+RC[-8]*RC[-3] -> 66 | M12: =RC[-6]+RC[-9]*RC[-3] -> 0 | N12: 0.4 | O12: 0.6 | P12: 0 | Q12: 0 | R12: 0 | S12: 0
A13: 宝箱 | B13: 宝箱 | C13: Monster07 | D13: 15 | E13: =RC[12]+100*RC[9] -> 80 | F13: =RC[12]+100*RC[9]*0.5 -> 10 | G13: =RC[12]+100*0.25*RC[9] -> 0 | H13: =RC[6]*20 -> 16 | I13: =RC[6]*0.25*20 -> 1 | J13: =RC[6]*0.125*20 -> 0 | K13: =RC[-6]+RC[-7]*RC[-3] -> 320 | L13: =RC[-6]+RC[-8]*RC[-3] -> 25 | M13: =RC[-6]+RC[-9]*RC[-3] -> 0 | N13: 0.8 | O13: 0.2 | P13: 0 | Q13: 0 | R13: 0 | S13: 0
A14: 不朽伯爵 | B14: 不朽伯爵 | C14: Monster08 | D14: 20 | E14: =RC[12]+100*RC[9] -> 40 | F14: =RC[12]+100*RC[9]*0.5 -> 30 | G14: =RC[12]+100*0.25*RC[9] -> 0 | H14: =RC[6]*20 -> 8 | I14: =RC[6]*0.25*20 -> 3 | J14: =RC[6]*0.125*20 -> 0 | K14: =RC[-6]+RC[-7]*RC[-3] -> 200 | L14: =RC[-6]+RC[-8]*RC[-3] -> 90 | M14: =RC[-6]+RC[-9]*RC[-3] -> 0 | N14: 0.4 | O14: 0.6 | P14: 0 | Q14: 0 | R14: 0 | S14: 0
A15: 千年树妖怪 | B15: 千年树妖怪 | C15: Monster09 | D15: 30 | E15: =RC[12]+100*RC[9] -> 70 | F15: =RC[12]+100*RC[9]*0.5 -> 15 | G15: =RC[12]+100*0.25*RC[9] -> 0 | H15: =RC[6]*20 -> 14 | I15: =RC[6]*0.25*20 -> 1.5 | J15: =RC[6]*0.125*20 -> 0 | K15: =RC[-6]+RC[-7]*RC[-3] -> 490 | L15: =RC[-6]+RC[-8]*RC[-3] -> 60 | M15: =RC[-6]+RC[-9]*RC[-3] -> 0 | N15: 0.7 | O15: 0.3 | P15: 0 | Q15: 0 | R15: 0 | S15: 0
A16: 千年毒虫 | B16: 千年毒虫 | C16: Monster10 | D16: 28 | E16: =RC[12]+100*RC[9] -> 40 | F16: =RC[12]+100*RC[9]*0.5 -> 30 | G16: =RC[12]+100*0.25*RC[9] -> 0 | H16: =RC[6]*20 -> 8 | I16: =RC[6]*0.25*20 -> 3 | J16: =RC[6]*0.125*20 -> 0 | K16: =RC[-6]+RC[-7]*RC[-3] -> 264 | L16: =RC[-6]+RC[-8]*RC[-3] -> 114 | M16: =RC[-6]+RC[-9]*RC[-3] -> 0 | N16: 0.4 | O16: 0.6 | P16: 0 | Q16: 0 | R16: 0 | S16: 0
A17: 魔王 | B17: 魔王 | C17: Monster11 | D17: 40 | E17: =RC[12]+100*RC[9] -> 50 | F17: =RC[12]+100*RC[9]*0.5 -> 25 | G17: =RC[12]+100*0.25*RC[9] -> 0 | H17: =RC[6]*20 -> 10 | I17: =RC[6]*0.25*20 -> 2.5 | J17: =RC[6]*0.125*20 -> 0 | K17: =RC[-6]+RC[-7]*RC[-3] -> 450 | L17: =RC[-6]+RC[-8]*RC[-3] -> 125 | M17: =RC[-6]+RC[-9]*RC[-3] -> 0 | N17: 0.5 | O17: 0.5 | P17: 0 | Q17: 0 | R17: 0 | S17: 0
A18: 巨石像 | B18: 巨石像 | C18: Monster12 | D18: 60 | E18: =RC[12]+100*RC[9] -> 90 | F18: =RC[12]+100*RC[9]*0.5 -> 5 | G18: =RC[12]+100*0.25*RC[9] -> 0 | H18: =RC[6]*20 -> 18 | I18: =RC[6]*0.25*20 -> 0.5 | J18: =RC[6]*0.125*20 -> 0 | K18: =RC[-6]+RC[-7]*RC[-3] -> 1170 | L18: =RC[-6]+RC[-8]*RC[-3] -> 35 | M18: =RC[-6]+RC[-9]*RC[-3] -> 0 | N18: 0.9 | O18: 0.1 | P18: 0 | Q18: 0 | R18: 0 | S18: 0
A19: 上古魔龙 | B19: 上古魔龙 | C19: Monster13 | D19: 80 | E19: =RC[12]+100*RC[9] -> 40 | F19: =RC[12]+100*RC[9]*0.5 -> 30 | G19: =RC[12]+100*0.25*RC[9] -> 0 | H19: =RC[6]*20 -> 8 | I19: =RC[6]*0.25*20 -> 3 | J19: =RC[6]*0.125*20 -> 0 | K19: =RC[-6]+RC[-7]*RC[-3] -> 680 | L19: =RC[-6]+RC[-8]*RC[-3] -> 270 | M19: =RC[-6]+RC[-9]*RC[-3] -> 0 | N19: 0.4 | O19: 0.6 | P19: 0 | Q19: 0 | R19: 0 | S19: 0
A20: 上古魔神 | B20: 上古魔神 | C20: Monster14 | D20: 99 | E20: =RC[12]+100*RC[9] -> 50 | F20: =RC[12]+100*RC[9]*0.5 -> 25 | G20: =RC[12]+100*0.25*RC[9] -> 0 | H20: =RC[6]*20 -> 10 | I20: =RC[6]*0.25*20 -> 2.5 | J20: =RC[6]*0.125*20 -> 0 | K20: =RC[-6]+RC[-7]*RC[-3] -> 1040 | L20: =RC[-6]+RC[-8]*RC[-3] -> 272.5 | M20: =RC[-6]+RC[-9]*RC[-3] -> 0 | N20: 0.5 | O20: 0.5 | P20: 0 | Q20: 0 | R20: 0 | S20: 0

Sheet: 怪物卡
A1: #itemCard
A2: $MonsterCard | B2: id | C2: name | D2: battlerName | E2: battlerID | F2: battlerLevel | G2: itemDropData
A3: 冒险者 | B3: 冒险者 | C3: 冒险者 | D3: 冒险者 | E3: 小战士 | F3: 4 | G3: %
A4: 小战士 | B4: 小战士 | C4: 小战士 | D4: 小战士 | E4: 小战士 | F4: 1 | G4: 小战士卡片:1
A5: 小法师 | B5: 小法师 | C5: 小法师 | D5: 小法师 | E5: 小法师 | F5: 1 | G5: 小法师卡片:1
A6: 小牧师 | B6: 小牧师 | C6: 小牧师 | D6: 小牧师 | E6: 小牧师 | F6: 1 | G6: 小牧师卡片:1
A7: 小猎人 | B7: 小猎人 | C7: 小猎人 | D7: 小猎人 | E7: 小猎人 | F7: 1 | G7: 小猎人卡片:1
A8: 大黄蜂 | B8: 大黄蜂 | C8: 大黄蜂 | D8: 大黄蜂 | E8: 大黄蜂 | F8: 2 | G8: 大黄蜂卡片:0.1
A9: 山洞蝙蝠 | B9: 山洞蝙蝠 | C9: 山洞蝙蝠 | D9: 山洞蝙蝠 | E9: 山洞蝙蝠 | F9: 3 | G9: 山洞蝙蝠卡片:0.1
A10: 洋娃娃 | B10: 洋娃娃 | C10: 洋娃娃 | D10: 洋娃娃 | E10: 洋娃娃 | F10: 4 | G10: 洋娃娃卡片:0.1
A11: 毒蘑菇 | B11: 毒蘑菇 | C11: 毒蘑菇 | D11: 毒蘑菇 | E11: 毒蘑菇 | F11: 6 | G11: 毒蘑菇卡片:0.1
A12: 蝎子 | B12: 蝎子 | C12: 蝎子 | D12: 蝎子 | E12: 蝎子 | F12: 10 | G12: 蝎子卡片:0.1
A13: 软泥怪 | B13: 软泥怪 | C13: 软泥怪 | D13: 软泥怪 | E13: 软泥怪 | F13: 12 | G13: 软泥怪卡片:0.1
A14: 宝箱 | B14: 宝箱 | C14: 宝箱 | D14: 宝箱 | E14: 宝箱 | F14: 15 | G14: 宝箱卡片:0.1
A15: 不朽伯爵 | B15: 不朽伯爵 | C15: 不朽伯爵 | D15: 不朽伯爵 | E15: 不朽伯爵 | F15: 20 | G15: 不朽伯爵卡片:0.1
A16: 千年树妖怪 | B16: 千年树妖怪 | C16: 千年树妖怪 | D16: 千年树妖怪 | E16: 千年树妖怪 | F16: 30 | G16: 千年树妖怪卡片:0.1
A17: 千年毒虫 | B17: 千年毒虫 | C17: 千年毒虫 | D17: 千年毒虫 | E17: 千年毒虫 | F17: 28 | G17: 千年毒虫卡片:0.1
A18: 魔王 | B18: 魔王 | C18: 魔王 | D18: 魔王 | E18: 魔王 | F18: 40 | G18: 魔王卡片:0.1
A19: 巨石像 | B19: 巨石像 | C19: 巨石像 | D19: 巨石像 | E19: 巨石像 | F19: 60 | G19: 巨石像卡片:0.1
A20: 上古魔龙 | B20: 上古魔龙 | C20: 上古魔龙 | D20: 上古魔龙 | E20: 上古魔龙 | F20: 80 | G20: 上古魔龙卡片:0.1
A21: 上古魔神 | B21: 上古魔神 | C21: 上古魔神 | D21: 上古魔神 | E21: 上古魔神 | F21: 99 | G21: 上古魔神卡片:0.1
A23: #initTeam
A24: $Object | B24: cardID
A25: pos1 | B25: 冒险者
A26: pos2 | B26: 上古魔神

Sheet: 掉落物品
A1: #item
A2: $Item | B2: name | C2: monsterCardID
A3: 冒险者卡片 | B3: 冒险者卡片 | C3: 冒险者
A4: 小战士卡片 | B4: 小战士卡片 | C4: 小战士
A5: 小法师卡片 | B5: 小法师卡片 | C5: 小法师
A6: 小牧师卡片 | B6: 小牧师卡片 | C6: 小牧师
A7: 小猎人卡片 | B7: 小猎人卡片 | C7: 小猎人
A8: 大黄蜂卡片 | B8: 大黄蜂卡片 | C8: 大黄蜂
A9: 山洞蝙蝠卡片 | B9: 山洞蝙蝠卡片 | C9: 山洞蝙蝠
A10: 洋娃娃卡片 | B10: 洋娃娃卡片 | C10: 洋娃娃
A11: 毒蘑菇卡片 | B11: 毒蘑菇卡片 | C11: 毒蘑菇
A12: 蝎子卡片 | B12: 蝎子卡片 | C12: 蝎子
A13: 软泥怪卡片 | B13: 软泥怪卡片 | C13: 软泥怪
A14: 宝箱卡片 | B14: 宝箱卡片 | C14: 宝箱
A15: 不朽伯爵卡片 | B15: 不朽伯爵卡片 | C15: 不朽伯爵
A16: 千年树妖怪卡片 | B16: 千年树妖怪卡片 | C16: 千年树妖怪
A17: 千年毒虫卡片 | B17: 千年毒虫卡片 | C17: 千年毒虫
A18: 魔王卡片 | B18: 魔王卡片 | C18: 魔王
A19: 巨石像卡片 | B19: 巨石像卡片 | C19: 巨石像
A20: 上古魔龙卡片 | B20: 上古魔龙卡片 | C20: 上古魔龙
A21: 上古魔神卡片 | B21: 上古魔神卡片 | C21: 上古魔神